<?xml version="1.0" encoding="UTF-8"?>
<list xmlns:xsi="http://www.w3.org/2001/XMLSchema-instance" xsi:noNamespaceSchemaLocation="rewards.xsd">
    <params minLevel="1" maxLevel="-1" coinId="94834"/> <!-- maxLevel -1 - no limit -->
    <multisells>3247847</multisells>
    <payback id="1" count="100">
        <item id="94269" count="10"/>
        <item id="94271" count="10"/> 
        <item id="49674" count="10"/> 
    </payback>
    <payback id="2" count="300">
        <item id="91757" count="5"/> 
        <item id="91712" count="5"/> 
        <item id="97145" count="30"/> 
    </payback>
    <payback id="3" count="500">
        <item id="96941" count="1"/> 
        <item id="91712" count="10"/>
        <item id="92020" count="2"/> 
    </payback>
    <payback id="4" count="700">
        <item id="94269" count="15"/>
        <item id="94271" count="15"/> 
        <item id="49674" count="15"/> 
    </payback>
    <payback id="5" count="1000">
        <item id="97145" count="50"/>
        <item id="97266" count="2"/> 
        <item id="49845" count="100"/>
    </payback>
    <payback id="6" count="1500">
        <item id="94269" count="25"/>
        <item id="94271" count="25"/>
        <item id="49674" count="25"/> 
    </payback>
    <payback id="7" count="2000">
        <item id="97145" count="100"/> 
        <item id="91712" count="20"/> 
        <item id="91757" count="20"/>
    </payback>
</list>